{"$schema":"https://json-schema.org/draft/2020-12/schema","$id":"https://vexil.dev/release/history/observations/observation-go-runtime-v0-1-1-publication-2026-07-26.json","version":"1.0","recordKind":"release-history-observation","observationId":"observation-go-runtime-v0-1-1-publication-2026-07-26","contentId":"sha256:72dc34c1b8af8130f2dcf1cd0001482dfd986946eb1c18599bf248790f61bd64","sourceId":"go-proxy","query":"GET https://proxy.golang.org/github.com/vexil-lang/vexil/packages/runtime-go/@v/v0.1.1.info; corroborated by git ls-remote --tags origin","state":"observed","observedAt":"2026-07-26T21:07:59Z","collectorVersion":"manual-read-only-publication-collector/1.0","claim":{"kind":"observed-publication","unitId":"vexil-runtime-go","target":{"kind":"go-module","name":"github.com/vexil-lang/vexil/packages/runtime-go"},"version":"0.1.1","canonicalTag":"packages/runtime-go/v0.1.1","tagObject":"4049f574804db87047c7eec33d727d7acc35273b","sourceCommit":"99e2afef4d48ab35ec61e8b23a9c0d6c210e275f","scope":"The public Go proxy and corroborating GitHub tag observation agree on the exact source commit. This preserves observed public state; it does not claim a workflow Run, start authorization, GitHub Release, registry upload, deployment, or bot action."}}
