{"$schema":"https://json-schema.org/draft/2020-12/schema","$id":"https://vexil-lang.org/release/history/observations/observation-go-proxy-runtime-2026-07-23.json","version":"1.0","recordKind":"release-history-observation","observationId":"observation-go-proxy-runtime-2026-07-23","contentId":"sha256:e3b0c44298fc1c149afbf4c8996fb92427ae41e4649b934ca495991b7852b855","sourceId":"go-proxy","query":"GET Go module proxy metadata for github.com/vexil-lang/vexil/packages/runtime-go","state":"missing","observedAt":"2026-07-23T13:37:10Z","collectorVersion":"manual-read-only-history-collector/0.1.0","claim":{"module":"github.com/vexil-lang/vexil/packages/runtime-go","versions":[],"scope":"The empty exact-path response does not prove the absence of another module identity."}}
