{"$schema":"https://json-schema.org/draft/2020-12/schema","$id":"https://vexil-lang.org/release/history/observations/observation-github-releases-2026-07-23.json","version":"1.0","recordKind":"release-history-observation","observationId":"observation-github-releases-2026-07-23","contentId":"sha256:52e81d0faf16126cccc016fec656d00469e4ed237a63bd36f55bb315b71a1699","sourceId":"github-releases","query":"GET /repos/vexil-lang/vexil/releases","state":"observed","observedAt":"2026-07-23T13:37:10Z","collectorVersion":"manual-read-only-history-collector/0.1.0","claim":{"releases":["vexilc-v0.5.1","vexilc-v0.5.0","v0.2.0","v0.1.0"],"scope":"Current GitHub release-list response only."}}
