{"$schema":"https://json-schema.org/draft/2020-12/schema","$id":"https://vexil.dev/release/history/observations/observation-crates-io-2026-07-23.json","version":"1.0","recordKind":"release-history-observation","observationId":"observation-crates-io-2026-07-23","contentId":"sha256:a3a3713fa28919cfb5389fc8e717220d9a79d1d2efa2ec3051170293d8b486c7","sourceId":"crates-io","query":"GET crates.io package metadata for vexil-lang, vexilc, vexil-runtime","state":"observed","observedAt":"2026-07-23T13:37:10Z","collectorVersion":"manual-read-only-history-collector/0.1.0","claim":{"latest":{"vexil-lang":"0.4.3","vexilc":"0.5.1","vexil-runtime":"0.5.1"}}}
