{"$schema":"https://json-schema.org/draft/2020-12/schema","$id":"https://vexil.dev/release/history/observations/observation-npm-runtime-2026-07-23.json","version":"1.0","recordKind":"release-history-observation","observationId":"observation-npm-runtime-2026-07-23","contentId":"sha256:39dac15bfe8eafa9602da3e5e56905f9c05b459469cd59ec77770acfd41bc07a","sourceId":"npm","query":"GET npm package metadata for @vexil-lang/runtime","state":"observed","observedAt":"2026-07-23T13:37:10Z","collectorVersion":"manual-read-only-history-collector/0.1.0","claim":{"package":"@vexil-lang/runtime","latest":"0.5.1"}}
