{"$schema":"https://json-schema.org/draft/2020-12/schema","$id":"https://vexil.dev/release/history/observations/observation-pypi-vexil-runtime-2026-07-23.json","version":"1.0","recordKind":"release-history-observation","observationId":"observation-pypi-vexil-runtime-2026-07-23","contentId":"sha256:52fcad3d2db7c4a4d1270fef3e3bb21a9bf9e8014569bb23629aface5853c2ea","sourceId":"pypi","query":"GET PyPI project metadata for vexil_runtime","state":"missing","observedAt":"2026-07-23T13:37:10Z","collectorVersion":"manual-read-only-history-collector/0.1.0","claim":{"queriedIdentity":"vexil_runtime","httpStatus":404,"scope":"This scoped query does not prove the absence of another PyPI identity."},"failureEvidence":"PyPI returned HTTP 404 for the exact queried identity."}
