{
  "$schema": "https://json-schema.org/draft/2020-12/schema",
  "$id": "https://vexil.dev/release/history/observations/observation-root-changelog-v1-0-0-2026-07-23.json",
  "version": "1.0",
  "recordKind": "release-history-observation",
  "observationId": "observation-root-changelog-v1-0-0-2026-07-23",
  "contentId": "sha256:1bc2948debca96e30383115f3047e45cbcbe380531480595efaa35ed6f0de22c",
  "sourceId": "repository-changelog",
  "query": "read CHANGELOG.md",
  "state": "observed",
  "observedAt": "2026-07-23T13:33:17Z",
  "collectorVersion": "manual-read-only-history-collector/0.1.0",
  "claim": {
    "path": "CHANGELOG.md",
    "heading": "v1.0.0 (2026-04-09)",
    "statement": "Language complete. New types, codegen for all backends, optimized runtime, comprehensive docs.",
    "scope": "This repository-file claim does not establish a Historical Tag, GitHub release, registry publication, or coordinated-project release."
  }
}
