{"$schema":"https://json-schema.org/draft/2020-12/schema","$id":"https://vexil-lang.org/release/history/observations/observation-release-artifacts-2026-07-23.json","version":"1.0","recordKind":"release-history-observation","observationId":"observation-release-artifacts-2026-07-23","contentId":"sha256:a10f3e0aad7a57462073cb55dfd67e5d13728f3482e797b45ed02f82eabeb9c2","sourceId":"release-artifacts","query":"GET immutable release assets via GitHub release metadata","state":"observed","observedAt":"2026-07-23T13:37:10Z","collectorVersion":"manual-read-only-history-collector/0.1.0","claim":{"assetCounts":{"vexilc-v0.5.1":16,"vexilc-v0.5.0":16,"v0.2.0":3,"v0.1.0":3},"scope":"Metadata is an observation; it does not itself verify each downloaded artifact."}}
