{"$schema":"https://json-schema.org/draft/2020-12/schema","$id":"https://vexil-lang.org/release/history/observations/observation-go-proxy-runtime-v0-1-0-2026-07-26.json","version":"1.0","recordKind":"release-history-observation","observationId":"observation-go-proxy-runtime-v0-1-0-2026-07-26","contentId":"sha256:d0b4f9120ba026c00fa23cb84b4e1620a2e6436592e58155a5151653179572c0","sourceId":"go-proxy","query":"GET https://proxy.golang.org/github.com/vexil-lang/vexil/packages/runtime-go/@v/list","state":"observed","observedAt":"2026-07-26T18:19:35Z","collectorVersion":"manual-read-only-history-collector/0.1.0","claim":{"kind":"observed-package-version","unitId":"vexil-runtime-go","target":{"kind":"go-module","name":"github.com/vexil-lang/vexil/packages/runtime-go"},"version":"0.1.0","canonicalTag":"packages/runtime-go/v0.1.0","scope":"The Go module proxy publicly returned v0.1.0. This is provider evidence only; it does not create, ratify, or retroactively authorize a Release Manifest, approval, Run, or publication."}}
