{"$schema":"https://json-schema.org/draft/2020-12/schema","$id":"https://vexil-lang.org/release/history/observations/observation-package-manifests-2026-07-23.json","version":"1.0","recordKind":"release-history-observation","observationId":"observation-package-manifests-2026-07-23","contentId":"sha256:7bcf1d1440d64f3ed570ca87f9f87628e9e91a2dd7618c7af77cb5c30923214d","sourceId":"package-manifests","query":"read Cargo.toml, packages/runtime-ts/package.json, packages/runtime-py/pyproject.toml, packages/runtime-go/go.mod","state":"observed","observedAt":"2026-07-23T13:37:10Z","collectorVersion":"manual-read-only-history-collector/0.1.0","claim":{"workspaceVersion":"0.4.2","npmRuntime":"0.4.1","pythonRuntime":"0.1.0","goModule":"github.com/vexil-lang/vexil/packages/runtime-go"}}
